neta	XiangnianZhou/neta	https://github.com/XiangnianZhou/neta	0	0	0	0	false	A SRT and ASS/SSA  subtitle parser 🦕
odds-converter	c-m-hunt/odds-converter	https://github.com/c-m-hunt/odds-converter	0	0	0	0	false	Deno project to convert betting odds
pkce-deno	DiFronzo/pkce-deno	https://github.com/DiFronzo/pkce-deno	0	0	0	0	false	PKCE code verifier and challenge generator for Deno.
propx	LuisPaGarcia/propx	https://github.com/LuisPaGarcia/propx	0	0	0	0	false	Access and create object props safe and with confidence
Specosaur	SachaCR/Specosaur	https://github.com/SachaCR/Specosaur	0	0	0	0	false	Specification pattern library for Deno.
template	deno-library/template	https://github.com/deno-library/template	0	0	0	0	false	Template engine for Deno
xrange	parzh/xrange	https://github.com/parzh/xrange	0	0	0	0	false	Python-esque iterator for number ranges
zlib.es	Brecert/zlib.es	https://github.com/Brecert/zlib.es	0	0	0	0	false	ECMAScript/Deno lightweight zlib implementation
Oak-GraphQL	avalero/Oak-GraphQL	https://github.com/avalero/Oak-GraphQL	0	0	0	0	false	A simple graphql middleware for oak deno framework.
deno-is-email	moncefplastin07/deno-is-email	https://github.com/moncefplastin07/deno-is-email	0	0	0	0	false	email address validation module for Deno 😁
usefuljs	ac5tin/usefuljs	https://github.com/ac5tin/usefuljs	0	0	0	0	false	List of js functions that might be useful